{
  "$schema": "https://json-schema.org/draft/2020-12/schema",
  "$id": "portal-security-baseline/v1",
  "type": "object",
  "additionalProperties": false,
  "required": [
    "schema_version",
    "policy_version",
    "generated_from_commit",
    "findings"
  ],
  "properties": {
    "schema_version": {"const": "portal-security-baseline/v1"},
    "policy_version": {"type": "string", "minLength": 1},
    "generated_from_commit": {"type": "string", "pattern": "^[0-9a-f]{40}$"},
    "findings": {
      "type": "array",
      "items": {
        "type": "object",
        "additionalProperties": false,
        "required": [
          "scanner",
          "scanner_version",
          "rule_or_vulnerability_id",
          "normalized_aliases",
          "package",
          "package_version",
          "ecosystem",
          "asset_identity",
          "repository_path",
          "safe_fingerprint",
          "first_seen_commit",
          "policy_version"
        ],
        "properties": {
          "scanner": {"type": "string"},
          "scanner_version": {"type": "string"},
          "rule_or_vulnerability_id": {"type": "string"},
          "normalized_aliases": {"type": "array", "items": {"type": "string"}},
          "package": {"type": "string"},
          "package_version": {"type": "string"},
          "ecosystem": {"type": "string"},
          "asset_identity": {"type": "string"},
          "repository_path": {"type": "string"},
          "safe_fingerprint": {"type": "string", "pattern": "^sha256:[0-9a-f]{64}$"},
          "first_seen_commit": {"type": "string", "pattern": "^[0-9a-f]{40}$"},
          "policy_version": {"type": "string"}
        }
      }
    }
  }
}
