{
  "schema_version": "portal-security-baseline/v1",
  "policy_version": "2026-07-29.2",
  "generated_from_commit": "534f5b70d677333299f0fa12a3011168f332a05c",
  "findings": [
    {"scanner":"osv","scanner_version":"2.3.8","rule_or_vulnerability_id":"CVE-2026-14257","normalized_aliases":["GHSA-mh99-v99m-4gvg"],"package":"brace-expansion","package_version":"1.1.16","ecosystem":"npm","asset_identity":"pnpm-lock.yaml","repository_path":"pnpm-lock.yaml","safe_fingerprint":"sha256:e61b93b5e77f3d31aac70734929c4ea4ccb99110db8a588f3e25d41bd45e6386","first_seen_commit":"945d07110879f0e771cc4e64e2315d1077b9007e","policy_version":"2026-07-29.2"},
    {"scanner":"osv","scanner_version":"2.3.8","rule_or_vulnerability_id":"CVE-2026-14257","normalized_aliases":["GHSA-mh99-v99m-4gvg"],"package":"brace-expansion","package_version":"5.0.7","ecosystem":"npm","asset_identity":"pnpm-lock.yaml","repository_path":"pnpm-lock.yaml","safe_fingerprint":"sha256:7f60a3051f311db871ded3823d758f02d96a62aba27e9600d80f78cd6b546c8e","first_seen_commit":"945d07110879f0e771cc4e64e2315d1077b9007e","policy_version":"2026-07-29.2"},
    {"scanner":"osv","scanner_version":"2.3.8","rule_or_vulnerability_id":"CVE-2026-26007","normalized_aliases":["GHSA-r6ph-v2qm-q3c2","PYSEC-2026-2141"],"package":"cryptography","package_version":"45.0.7","ecosystem":"PyPI","asset_identity":"apps/portal-api/requirements.lock","repository_path":"apps/portal-api/requirements.lock","safe_fingerprint":"sha256:c2cc6cddf01e20e3ffa989b7d3b02a3e47fd052137237a919846183e6baed8d0","first_seen_commit":"945d07110879f0e771cc4e64e2315d1077b9007e","policy_version":"2026-07-29.2"},
    {"scanner":"osv","scanner_version":"2.3.8","rule_or_vulnerability_id":"CVE-2026-26007","normalized_aliases":["GHSA-r6ph-v2qm-q3c2","PYSEC-2026-2141"],"package":"cryptography","package_version":"45.0.7","ecosystem":"PyPI","asset_identity":"apps/portal-api/requirements-dev.lock","repository_path":"apps/portal-api/requirements-dev.lock","safe_fingerprint":"sha256:dd3e051f2f1375b3cee542016289a31e761dedd5a33d10fca3f2a868ba352714","first_seen_commit":"945d07110879f0e771cc4e64e2315d1077b9007e","policy_version":"2026-07-29.2"},
    {"scanner":"osv","scanner_version":"2.3.8","rule_or_vulnerability_id":"CVE-2026-34073","normalized_aliases":["GHSA-m959-cc7f-wv43","PYSEC-2026-35"],"package":"cryptography","package_version":"45.0.7","ecosystem":"PyPI","asset_identity":"apps/portal-api/requirements.lock","repository_path":"apps/portal-api/requirements.lock","safe_fingerprint":"sha256:3103e22b360d492dc972fe12ddd531e0b375d4b4025b58224fbf41d13d988cab","first_seen_commit":"945d07110879f0e771cc4e64e2315d1077b9007e","policy_version":"2026-07-29.2"},
    {"scanner":"osv","scanner_version":"2.3.8","rule_or_vulnerability_id":"CVE-2026-34073","normalized_aliases":["GHSA-m959-cc7f-wv43","PYSEC-2026-35"],"package":"cryptography","package_version":"45.0.7","ecosystem":"PyPI","asset_identity":"apps/portal-api/requirements-dev.lock","repository_path":"apps/portal-api/requirements-dev.lock","safe_fingerprint":"sha256:1e7b4428d583a84abf54c6c5b58708a81f77333787b45c95b93e6a50494b3ea5","first_seen_commit":"945d07110879f0e771cc4e64e2315d1077b9007e","policy_version":"2026-07-29.2"},
    {"scanner":"osv","scanner_version":"2.3.8","rule_or_vulnerability_id":"CVE-2026-39363","normalized_aliases":["GHSA-p9ff-h696-f583"],"package":"vite","package_version":"8.0.2","ecosystem":"npm","asset_identity":"pnpm-lock.yaml","repository_path":"pnpm-lock.yaml","safe_fingerprint":"sha256:755733af403198bdae2b4dd156c5461435102eb68141fad824f593d72f8236a1","first_seen_commit":"945d07110879f0e771cc4e64e2315d1077b9007e","policy_version":"2026-07-29.2"},
    {"scanner":"osv","scanner_version":"2.3.8","rule_or_vulnerability_id":"CVE-2026-39364","normalized_aliases":["GHSA-v2wj-q39q-566r"],"package":"vite","package_version":"8.0.2","ecosystem":"npm","asset_identity":"pnpm-lock.yaml","repository_path":"pnpm-lock.yaml","safe_fingerprint":"sha256:a985582817a5f80349208a6c90ee22ec14bda68e2ab683bbf07c31397a49f23a","first_seen_commit":"945d07110879f0e771cc4e64e2315d1077b9007e","policy_version":"2026-07-29.2"},
    {"scanner":"osv","scanner_version":"2.3.8","rule_or_vulnerability_id":"CVE-2026-39365","normalized_aliases":["GHSA-4w7w-66w2-5vf9"],"package":"vite","package_version":"8.0.2","ecosystem":"npm","asset_identity":"pnpm-lock.yaml","repository_path":"pnpm-lock.yaml","safe_fingerprint":"sha256:d79c4d9a18eee2f2605af505fca153435cf3ce02a0fa84195de5a66bf3eb2a20","first_seen_commit":"945d07110879f0e771cc4e64e2315d1077b9007e","policy_version":"2026-07-29.2"},
    {"scanner":"osv","scanner_version":"2.3.8","rule_or_vulnerability_id":"CVE-2026-39892","normalized_aliases":["GHSA-p423-j2cm-9vmq","PYSEC-2026-36"],"package":"cryptography","package_version":"45.0.7","ecosystem":"PyPI","asset_identity":"apps/portal-api/requirements.lock","repository_path":"apps/portal-api/requirements.lock","safe_fingerprint":"sha256:d4dc7e00bbbae2338f24e7f3fc6b3953c55358258f60e4e8afaa108e258f74a7","first_seen_commit":"945d07110879f0e771cc4e64e2315d1077b9007e","policy_version":"2026-07-29.2"},
    {"scanner":"osv","scanner_version":"2.3.8","rule_or_vulnerability_id":"CVE-2026-39892","normalized_aliases":["GHSA-p423-j2cm-9vmq","PYSEC-2026-36"],"package":"cryptography","package_version":"45.0.7","ecosystem":"PyPI","asset_identity":"apps/portal-api/requirements-dev.lock","repository_path":"apps/portal-api/requirements-dev.lock","safe_fingerprint":"sha256:eb31a0cdae55650ed1c75a83b9b85b9f16204c17f01b46d51ec3cfbc96e70069","first_seen_commit":"945d07110879f0e771cc4e64e2315d1077b9007e","policy_version":"2026-07-29.2"},
    {"scanner":"osv","scanner_version":"2.3.8","rule_or_vulnerability_id":"CVE-2026-41305","normalized_aliases":["GHSA-qx2v-qp2m-jg93"],"package":"postcss","package_version":"8.4.31","ecosystem":"npm","asset_identity":"pnpm-lock.yaml","repository_path":"pnpm-lock.yaml","safe_fingerprint":"sha256:56d5176623a9576a8199fe3879c10e723db29293d53dbe83d73a5da2d0f7f0d0","first_seen_commit":"945d07110879f0e771cc4e64e2315d1077b9007e","policy_version":"2026-07-29.2"},
    {"scanner":"osv","scanner_version":"2.3.8","rule_or_vulnerability_id":"CVE-2026-45623","normalized_aliases":["GHSA-6g55-p6wh-862q"],"package":"postcss","package_version":"8.4.31","ecosystem":"npm","asset_identity":"pnpm-lock.yaml","repository_path":"pnpm-lock.yaml","safe_fingerprint":"sha256:7a9458e0dc0759ee400036fb5ac2853a7dacb5e2a1ba58b2716558ec4dc4e86d","first_seen_commit":"945d07110879f0e771cc4e64e2315d1077b9007e","policy_version":"2026-07-29.2"},
    {"scanner":"osv","scanner_version":"2.3.8","rule_or_vulnerability_id":"CVE-2026-53571","normalized_aliases":["GHSA-fx2h-pf6j-xcff"],"package":"vite","package_version":"8.0.2","ecosystem":"npm","asset_identity":"pnpm-lock.yaml","repository_path":"pnpm-lock.yaml","safe_fingerprint":"sha256:8e4f31636cdd4c317f237d3b16bf2e925eac74e23e06f6b4a9363505a2b9f602","first_seen_commit":"945d07110879f0e771cc4e64e2315d1077b9007e","policy_version":"2026-07-29.2"},
    {"scanner":"osv","scanner_version":"2.3.8","rule_or_vulnerability_id":"CVE-2026-53632","normalized_aliases":["GHSA-v6wh-96g9-6wx3"],"package":"vite","package_version":"8.0.2","ecosystem":"npm","asset_identity":"pnpm-lock.yaml","repository_path":"pnpm-lock.yaml","safe_fingerprint":"sha256:a476498baac02c6fb9fefe4178a930393e8ff56f182bd19ef5e864710207878c","first_seen_commit":"945d07110879f0e771cc4e64e2315d1077b9007e","policy_version":"2026-07-29.2"},
    {"scanner":"osv","scanner_version":"2.3.8","rule_or_vulnerability_id":"CVE-2026-59869","normalized_aliases":["GHSA-52cp-r559-cp3m"],"package":"js-yaml","package_version":"4.2.0","ecosystem":"npm","asset_identity":"pnpm-lock.yaml","repository_path":"pnpm-lock.yaml","safe_fingerprint":"sha256:90917c94ba838cc890e449916bd47564026775e12b738d8dde0c9bad1506b753","first_seen_commit":"945d07110879f0e771cc4e64e2315d1077b9007e","policy_version":"2026-07-29.2"},
    {"scanner":"osv","scanner_version":"2.3.8","rule_or_vulnerability_id":"GHSA-537c-gmf6-5ccf","normalized_aliases":[],"package":"cryptography","package_version":"45.0.7","ecosystem":"PyPI","asset_identity":"apps/portal-api/requirements.lock","repository_path":"apps/portal-api/requirements.lock","safe_fingerprint":"sha256:c7a18a27d37f83239b5de2671ff74ae847967814e5bd204edb04e7d1961e58ac","first_seen_commit":"945d07110879f0e771cc4e64e2315d1077b9007e","policy_version":"2026-07-29.2"},
    {"scanner":"osv","scanner_version":"2.3.8","rule_or_vulnerability_id":"GHSA-537c-gmf6-5ccf","normalized_aliases":[],"package":"cryptography","package_version":"45.0.7","ecosystem":"PyPI","asset_identity":"apps/portal-api/requirements-dev.lock","repository_path":"apps/portal-api/requirements-dev.lock","safe_fingerprint":"sha256:a1833ddfd7668ef1284e26e60bc9499bfe402bc1f4fcd27fd5ea6f0f1f263c8c","first_seen_commit":"945d07110879f0e771cc4e64e2315d1077b9007e","policy_version":"2026-07-29.2"},
    {"scanner":"osv","scanner_version":"2.3.8","rule_or_vulnerability_id":"GHSA-f88m-g3jw-g9cj","normalized_aliases":[],"package":"sharp","package_version":"0.34.5","ecosystem":"npm","asset_identity":"pnpm-lock.yaml","repository_path":"pnpm-lock.yaml","safe_fingerprint":"sha256:8e12d2e9bf9ab542beeb060250d631f8688b17f1d91cbfda16a95d1ed6857a1f","first_seen_commit":"945d07110879f0e771cc4e64e2315d1077b9007e","policy_version":"2026-07-29.2"},
    {"scanner":"osv","scanner_version":"2.3.8","rule_or_vulnerability_id":"GHSA-r28c-9q8g-f849","normalized_aliases":[],"package":"postcss","package_version":"8.4.31","ecosystem":"npm","asset_identity":"pnpm-lock.yaml","repository_path":"pnpm-lock.yaml","safe_fingerprint":"sha256:684b90df30e1ac3d48b840b0e7495c8eb1243d8793eb1172294d333107e2ed58","first_seen_commit":"945d07110879f0e771cc4e64e2315d1077b9007e","policy_version":"2026-07-29.2"},